C:\>cd "Program files"
C:\Program Files>cd MySQL
C:\Program Files\MySQL>cd "MySQL Server 8.0"
C:\Program Files\MySQL\MySQL Server 8.0>cd bin
C:\Program Files\MySQL\MySQL Server 8.0\bin>mysql -u root -p
Enter password: ****

SHOW DATABASES;
CREATE DATABASE sql_course;
SHOW DATABASES;
DROP DATABASE sql_course;
SHOW DATABASES;
CREATE DATABASE sql_course;
SHOW DATABASES;
USE sql_course;
show tables;

 CREATE TABLE teacher(
    -> id INT AUTO_INCREMENT PRIMARY KEY,
    -> surname VARCHAR(255) NOT NULL
    -> );
	
show tables;
show columns FROM teacher;

CREATE TABLE lesson(
    -> id INT AUTO_INCREMENT PRIMARY KEY,
    -> name VARCHAR(255) NOT NULL,
    -> teacher_id INT NOT NULL,
    -> FOREIGN KEY (teacher_id) references teacher(id)
    -> );
	
show tables;
show columns from lesson;

INSERT INTO teacher (surname) values ("Иванов");
INSERT INTO teacher (surname) values ("Иванов");
INSERT INTO teacher (surname) values ("Петров");
INSERT INTO teacher (surname) values ("Сидоров");
INSERT INTO teacher (surname) values ("Чижов");	
INSERT INTO teacher (surname) values ("Петров");
INSERT INTO teacher (surname) values ("Петров");

SELECT * FROM teacher;

SELECT id FROM teacher;
SELECT id, surname, surname FROM teacher;
SELECT DISTINCT surname FROM teacher;
SELECT * FROM teacher WHERE id = 1;
SELECT * FROM teacher WHERE id = 3;
SELECT * FROM teacher WHERE id > 3;

SELECT * FROM teacher WHERE surname = "Петров";
SELECT * FROM teacher WHERE surname = "Петров" LIMIT 2;
SELECT * FROM teacher WHERE surname = "Петров" LIMIT 1;
SELECT * FROM teacher LIMIT 5;

SELECT id AS 'ИДЕНТИФИКАТОР', surname AS 'Фамилия' FROM teacher;

SELECT * FROM teacher ORDER BY surname;
SELECT * FROM teacher ORDER BY id
SELECT * FROM teacher ORDER BY id DESC;

ALTER TABLE teacher ADD age INT;
show columns from teacher;
select * from teacher;

UPDATE teacher SET age = 20 where id=1;
select * from teacher;
UPDATE teacher SET age = 25;

UPDATE teacher SET age = 30 where id=2;
UPDATE teacher SET age = 35 where id=3;
UPDATE teacher SET age = 40 where id=4;
UPDATE teacher SET age = 45 where id=5;
UPDATE teacher SET age = 50 where id=6;

select * from teacher;
SELECT * FROM teacher WHERE surname LIKE "%ов";
SELECT * FROM teacher WHERE surname LIKE "п%ов";
SELECT * FROM teacher WHERE id > 3 AND age < 45;
SELECT * FROM teacher WHERE id > 3 AND age < 46;
SELECT * FROM teacher WHERE id > 4 AND age > 31;
SELECT * FROM teacher WHERE NOT id = 2;
SELECT * FROM teacher WHERE age BETWEEN 35 and 45;

DELETE FROM teacher WHERE id = 6;
SELECT * FROM teacher;

INSERT INTO lesson (name, teacher_id) VALUES ("Математика", 1), ("Информатика", 1), ("Русский", 2), ("Физика", 3);

select * from lesson;

SELECT teacher.surname, lesson.name FROM teacher INNER JOIN lesson ON teacher.id = lesson.teacher_id;
SELECT teacher.surname, lesson.name FROM teacher LEFT OUTER JOIN lesson ON teacher.id = lesson.teacher_id;
SELECT teacher.surname, lesson.name FROM teacher RIGHT OUTER JOIN lesson ON teacher.id = lesson.teacher_id;

ВЕРТИКАЛЬНОЕ ОБЪЕДИНЕНИЕ ТАБЛИЦ
SELECT * FROM teacher UNION SELECT * FROM lesson;
SELECT * FROM lesson UNION SELECT * FROM teacher;

ФУНКЦИИ: AVG => СРЕДНЕЕ ЗНАЧЕНИЕ, MAX, MIN, SUM ...
SELECT AVG(age) FROM teacher;
+----------+
| AVG(age) |
+----------+
|  35.0000 |
+----------+

SELECT MAX(age), MIN(age) FROM teacher;
+----------+----------+
| MAX(age) | MIN(age) |
+----------+----------+
|       45 |       25 |
+----------+----------+

SELECT SUM(age) FROM teacher;
+----------+
| SUM(age) |
+----------+
|      175 |
+----------+

INSERT INTO teacher (surname, age) VALUES ("Николаев", 25), ("Шишкин", 30);

select * from teacher;
+----+----------+------+
| id | surname  | age  |
+----+----------+------+
|  1 | Иванов   |   25 |
|  2 | Петров   |   30 |
|  3 | Сидоров  |   35 |
|  4 | Чижов    |   40 |
|  5 | Петров   |   45 |
|  7 | Николаев |   25 |
|  8 | Шишкин   |   30 |
+----+----------+------+

SELECT age, COUNT(age) FROM teacher GROUP BY age;
+------+------------+
| age  | COUNT(age) |
+------+------------+
|   25 |          2 |
|   30 |          2 |
|   35 |          1 |
|   40 |          1 |
|   45 |          1 |
+------+------------+

INSERT INTO teacher (surname, age) VALUES ("Николаев", 25), ("Шишкин", 30);

select * from teacher;
+----+----------+------+
| id | surname  | age  |
+----+----------+------+
|  1 | Иванов   |   25 |
|  2 | Петров   |   30 |
|  3 | Сидоров  |   35 |
|  4 | Чижов    |   40 |
|  5 | Петров   |   45 |
|  7 | Николаев |   25 |
|  8 | Шишкин   |   30 |
+----+----------+------+

SELECT age, COUNT(age) FROM teacher GROUP BY age;
+------+------------+
| age  | COUNT(age) |
+------+------------+
|   25 |          2 |
|   30 |          2 |
|   35 |          1 |
|   40 |          1 |
|   45 |          1 |
+------+------------+



mysql> SHOW DATABASES;
+--------------------+
| Database           |
+--------------------+
| information_schema |
| mysql              |
| performance_schema |
| sakila             |
| sys                |
| test_1             |
| world              |
+--------------------+
7 rows in set (0.00 sec)

mysql> CREATE DATABASE sql_course;
Query OK, 1 row affected (0.01 sec)

mysql> SHOW DATABASES;
+--------------------+
| Database           |
+--------------------+
| information_schema |
| mysql              |
| performance_schema |
| sakila             |
| sql_course         |
| sys                |
| test_1             |
| world              |
+--------------------+
8 rows in set (0.00 sec)

mysql> DROP DATABASE sql_course;
Query OK, 0 rows affected (0.01 sec)

mysql> SHOW DATABASES;
+--------------------+
| Database           |
+--------------------+
| information_schema |
| mysql              |
| performance_schema |
| sakila             |
| sys                |
| test_1             |
| world              |
+--------------------+
7 rows in set (0.00 sec)

mysql> CREATE DATABASE sql_course;
Query OK, 1 row affected (0.00 sec)

mysql> SHOW DATABASES;
+--------------------+
| Database           |
+--------------------+
| information_schema |
| mysql              |
| performance_schema |
| sakila             |
| sql_course         |
| sys                |
| test_1             |
| world              |
+--------------------+
8 rows in set (0.00 sec)

mysql> USE sql_course;
Database changed

mysql> show tables;
Empty set (0.00 sec)


mysql> CREATE TABLE teacher(
    -> id INT AUTO_INCREMENT PRIMARY KEY,
    -> surname VARCHAR(255) NOT NULL
    -> );
	
	mysql> show tables;
+----------------------+
| Tables_in_sql_course |
+----------------------+
| teacher              |
+----------------------+
1 row in set (0.00 sec)

mysql> show columns FROM teacher;
+---------+--------------+------+-----+---------+----------------+
| Field   | Type         | Null | Key | Default | Extra          |
+---------+--------------+------+-----+---------+----------------+
| id      | int          | NO   | PRI | NULL    | auto_increment |
| surname | varchar(255) | NO   |     | NULL    |                |
+---------+--------------+------+-----+---------+----------------+
2 rows in set (0.00 sec)

mysql> CREATE TABLE lesson(
    -> id INT AUTO_INCREMENT PRIMARY KEY,
    -> name VARCHAR(255) NOT NULL,
    -> teacher_id INT NOT NULL,
    -> FOREIGN KEY (teacher_id) references teacher(id)
    -> );
Query OK, 0 rows affected (0.02 sec)

mysql> show tables;
+----------------------+
| Tables_in_sql_course |
+----------------------+
| lesson               |
| teacher              |
+----------------------+
2 rows in set (0.00 sec)

mysql> show columns from lesson;
+------------+--------------+------+-----+---------+----------------+
| Field      | Type         | Null | Key | Default | Extra          |
+------------+--------------+------+-----+---------+----------------+
| id         | int          | NO   | PRI | NULL    | auto_increment |
| name       | varchar(255) | NO   |     | NULL    |                |
| teacher_id | int          | NO   | MUL | NULL    |                |
+------------+--------------+------+-----+---------+----------------+
3 rows in set (0.00 sec)

mysql> INSERT INTO teacher (surname) values ("Иванов");
Query OK, 1 row affected (0.01 sec)

mysql> INSERT INTO teacher (surname) values ("Иванов");
Query OK, 1 row affected (0.01 sec)

mysql> INSERT INTO teacher (surname) values ("Петров");
Query OK, 1 row affected (0.00 sec)

mysql> INSERT INTO teacher (surname) values ("Сидоров");
Query OK, 1 row affected (0.00 sec)

mysql> INSERT INTO teacher (surname) values ("Чижов");
Query OK, 1 row affected (0.00 sec)

mysql> INSERT INTO teacher (surname) values ("Петров");
Query OK, 1 row affected (0.00 sec)

mysql> INSERT INTO teacher (surname) values ("Петров");
Query OK, 1 row affected (0.00 sec)

mysql> SELECT * FROM teacher;
+----+---------+
| id | surname |
+----+---------+
|  1 | Иванов  |
|  2 | Петров  |
|  3 | Сидоров |
|  4 | Чижов   |
|  5 | Петров  |
|  6 | Петров  |
+----+---------+
6 rows in set (0.00 sec)

mysql> SELECT id FROM teacher;
+----+
| id |
+----+
|  1 |
|  2 |
|  3 |
|  4 |
|  5 |
|  6 |
+----+
6 rows in set (0.00 sec)

mysql> SELECT id, surname, surname FROM teacher;
+----+---------+---------+
| id | surname | surname |
+----+---------+---------+
|  1 | Иванов  | Иванов  |
|  2 | Петров  | Петров  |
|  3 | Сидоров | Сидоров |
|  4 | Чижов   | Чижов   |
|  5 | Петров  | Петров  |
|  6 | Петров  | Петров  |
+----+---------+---------+
6 rows in set (0.00 sec)

mysql> SELECT DISTINCT surname FROM teacher;
+---------+
| surname |
+---------+
| Иванов  |
| Петров  |
| Сидоров |
| Чижов   |
+---------+
4 rows in set (0.00 sec)

mysql> SELECT * FROM teacher WHERE id = 1;
+----+---------+
| id | surname |
+----+---------+
|  1 | Иванов  |
+----+---------+
1 row in set (0.00 sec)

mysql> SELECT * FROM teacher WHERE id = 3;
+----+---------+
| id | surname |
+----+---------+
|  3 | Сидоров |
+----+---------+
1 row in set (0.00 sec)

mysql> SELECT * FROM teacher WHERE id > 3;
+----+---------+
| id | surname |
+----+---------+
|  4 | Чижов   |
|  5 | Петров  |
|  6 | Петров  |
+----+---------+
3 rows in set (0.00 sec)

mysql> SELECT * FROM teacher WHERE id < 3;
+----+---------+
| id | surname |
+----+---------+
|  1 | Иванов  |
|  2 | Петров  |
+----+---------+
2 rows in set (0.00 sec)

mysql> SELECT * FROM teacher WHERE surname = "Петров";
+----+---------+
| id | surname |
+----+---------+
|  2 | Петров  |
|  5 | Петров  |
|  6 | Петров  |
+----+---------+
3 rows in set (0.00 sec)

mysql> SELECT * FROM teacher WHERE surname = "Петров" LIMIT 2;
+----+---------+
| id | surname |
+----+---------+
|  2 | Петров  |
|  5 | Петров  |
+----+---------+
2 rows in set (0.00 sec)

mysql> SELECT * FROM teacher WHERE surname = "Петров" LIMIT 1;
+----+---------+
| id | surname |
+----+---------+
|  2 | Петров  |
+----+---------+
1 row in set (0.00 sec)

mysql> SELECT * FROM teacher LIMIT 5;
+----+---------+
| id | surname |
+----+---------+
|  1 | Иванов  |
|  2 | Петров  |
|  3 | Сидоров |
|  4 | Чижов   |
|  5 | Петров  |
+----+---------+
5 rows in set (0.00 sec)

mysql> SELECT id AS 'ИДЕНТИФИКАТОР', surname AS 'Фамилия' FROM teacher;
+---------------+---------+
| ИДЕНТИФИКАТОР | Фамилия |
+---------------+---------+
|             1 | Иванов  |
|             2 | Петров  |
|             3 | Сидоров |
|             4 | Чижов   |
|             5 | Петров  |
|             6 | Петров  |
+---------------+---------+
6 rows in set (0.00 sec)

mysql> SELECT * FROM teacher ORDER BY surname;
+----+---------+
| id | surname |
+----+---------+
|  1 | Иванов  |
|  2 | Петров  |
|  5 | Петров  |
|  6 | Петров  |
|  3 | Сидоров |
|  4 | Чижов   |
+----+---------+
6 rows in set (0.00 sec)

mysql> SELECT * FROM teacher ORDER BY id;
+----+---------+
| id | surname |
+----+---------+
|  1 | Иванов  |
|  2 | Петров  |
|  3 | Сидоров |
|  4 | Чижов   |
|  5 | Петров  |
|  6 | Петров  |
+----+---------+
6 rows in set (0.00 sec)

mysql> SELECT * FROM teacher ORDER BY id DESC;
+----+---------+
| id | surname |
+----+---------+
|  6 | Петров  |
|  5 | Петров  |
|  4 | Чижов   |
|  3 | Сидоров |
|  2 | Петров  |
|  1 | Иванов  |
+----+---------+
6 rows in set (0.00 sec)

mysql> ALTER TABLE teacher ADD age INT;
Query OK, 0 rows affected (0.02 sec)
Records: 0  Duplicates: 0  Warnings: 0

mysql> show columns from teacher;
+---------+--------------+------+-----+---------+----------------+
| Field   | Type         | Null | Key | Default | Extra          |
+---------+--------------+------+-----+---------+----------------+
| id      | int          | NO   | PRI | NULL    | auto_increment |
| surname | varchar(255) | NO   |     | NULL    |                |
| age     | int          | YES  |     | NULL    |                |
+---------+--------------+------+-----+---------+----------------+
3 rows in set (0.00 sec)

mysql> select * from teacher;
+----+---------+------+
| id | surname | age  |
+----+---------+------+
|  1 | Иванов  | NULL |
|  2 | Петров  | NULL |
|  3 | Сидоров | NULL |
|  4 | Чижов   | NULL |
|  5 | Петров  | NULL |
|  6 | Петров  | NULL |
+----+---------+------+
6 rows in set (0.00 sec)

mysql> UPDATE teacher SET age = 20 where id=1;
Query OK, 1 row affected (0.00 sec)
Rows matched: 1  Changed: 1  Warnings: 0

mysql> select * from teacher;
+----+---------+------+
| id | surname | age  |
+----+---------+------+
|  1 | Иванов  |   20 |
|  2 | Петров  | NULL |
|  3 | Сидоров | NULL |
|  4 | Чижов   | NULL |
|  5 | Петров  | NULL |
|  6 | Петров  | NULL |
+----+---------+------+
6 rows in set (0.00 sec)

mysql> UPDATE teacher SET age = 25;
Query OK, 6 rows affected (0.00 sec)
Rows matched: 6  Changed: 6  Warnings: 0

mysql> select * from teacher;
+----+---------+------+
| id | surname | age  |
+----+---------+------+
|  1 | Иванов  |   25 |
|  2 | Петров  |   25 |
|  3 | Сидоров |   25 |
|  4 | Чижов   |   25 |
|  5 | Петров  |   25 |
|  6 | Петров  |   25 |
+----+---------+------+
6 rows in set (0.00 sec)

mysql> UPDATE teacher SET age = 30 where id=2;
Query OK, 1 row affected (0.00 sec)
Rows matched: 1  Changed: 1  Warnings: 0

mysql> UPDATE teacher SET age = 35 where id=3;
Query OK, 1 row affected (0.00 sec)
Rows matched: 1  Changed: 1  Warnings: 0

mysql> UPDATE teacher SET age = 40 where id=4;
Query OK, 1 row affected (0.00 sec)
Rows matched: 1  Changed: 1  Warnings: 0

mysql> UPDATE teacher SET age = 45 where id=5;
Query OK, 1 row affected (0.00 sec)
Rows matched: 1  Changed: 1  Warnings: 0

mysql> UPDATE teacher SET age = 50 where id=6;
Query OK, 1 row affected (0.00 sec)
Rows matched: 1  Changed: 1  Warnings: 0

mysql> select * from teacher;
+----+---------+------+
| id | surname | age  |
+----+---------+------+
|  1 | Иванов  |   25 |
|  2 | Петров  |   30 |
|  3 | Сидоров |   35 |
|  4 | Чижов   |   40 |
|  5 | Петров  |   45 |
|  6 | Петров  |   50 |
+----+---------+------+
6 rows in set (0.00 sec)

mysql> SELECT * FROM teacher WHERE surname LIKE "%ов";
+----+---------+------+
| id | surname | age  |
+----+---------+------+
|  1 | Иванов  |   25 |
|  2 | Петров  |   30 |
|  3 | Сидоров |   35 |
|  4 | Чижов   |   40 |
|  5 | Петров  |   45 |
|  6 | Петров  |   50 |
+----+---------+------+
6 rows in set (0.00 sec)

mysql> SELECT * FROM teacher WHERE surname LIKE "п%ов";
+----+---------+------+
| id | surname | age  |
+----+---------+------+
|  2 | Петров  |   30 |
|  5 | Петров  |   45 |
|  6 | Петров  |   50 |
+----+---------+------+
3 rows in set (0.00 sec)

mysql> SELECT * FROM teacher WHERE id > 3 AND age < 45;
+----+---------+------+
| id | surname | age  |
+----+---------+------+
|  4 | Чижов   |   40 |
+----+---------+------+
1 row in set (0.00 sec)

mysql> SELECT * FROM teacher WHERE id > 3 AND age < 46;
+----+---------+------+
| id | surname | age  |
+----+---------+------+
|  4 | Чижов   |   40 |
|  5 | Петров  |   45 |
+----+---------+------+
2 rows in set (0.00 sec)

mysql> SELECT * FROM teacher WHERE id > 4 AND age > 31;
+----+---------+------+
| id | surname | age  |
+----+---------+------+
|  5 | Петров  |   45 |
|  6 | Петров  |   50 |
+----+---------+------+
2 rows in set (0.00 sec)

mysql> SELECT * FROM teacher WHERE NOT id = 2;
+----+---------+------+
| id | surname | age  |
+----+---------+------+
|  1 | Иванов  |   25 |
|  3 | Сидоров |   35 |
|  4 | Чижов   |   40 |
|  5 | Петров  |   45 |
|  6 | Петров  |   50 |
+----+---------+------+
5 rows in set (0.00 sec)

mysql> SELECT * FROM teacher WHERE age BETWEEN 35 and 45;
+----+---------+------+
| id | surname | age  |
+----+---------+------+
|  3 | Сидоров |   35 |
|  4 | Чижов   |   40 |
|  5 | Петров  |   45 |
+----+---------+------+
3 rows in set (0.00 sec)

mysql> DELETE FROM teacher WHERE id = 6;
Query OK, 1 row affected (0.00 sec)

mysql> SELECT * FROM teacher;
+----+---------+------+
| id | surname | age  |
+----+---------+------+
|  1 | Иванов  |   25 |
|  2 | Петров  |   30 |
|  3 | Сидоров |   35 |
|  4 | Чижов   |   40 |
|  5 | Петров  |   45 |
+----+---------+------+
5 rows in set (0.00 sec)

mysql> INSERT INTO lesson (name, teacher_id) VALUES ("Математика", 1), ("Информатика", 1), ("Русский", 2), ("Физика", 3);
Query OK, 4 rows affected (0.01 sec)
Records: 4  Duplicates: 0  Warnings: 0

mysql> select * from lesson;
+----+-------------+------------+
| id | name        | teacher_id |
+----+-------------+------------+
|  1 | Математика  |          1 |
|  2 | Информатика |          1 |
|  3 | Русский     |          2 |
|  4 | Физика      |          3 |
|  5 | Математика  |          1 |
|  6 | Информатика |          1 |
|  7 | Русский     |          2 |
|  8 | Физика      |          3 |
+----+-------------+------------+
8 rows in set (0.00 sec)

mysql> SELECT teacher.surname, lesson.name FROM teacher INNER JOIN lesson ON teacher.id = lesson.teacher_id;
+---------+-------------+
| surname | name        |
+---------+-------------+
| Иванов  | Математика  |
| Иванов  | Информатика |
| Иванов  | Математика  |
| Иванов  | Информатика |
| Петров  | Русский     |
| Петров  | Русский     |
| Сидоров | Физика      |
| Сидоров | Физика      |
+---------+-------------+
8 rows in set (0.00 sec)

mysql> SELECT teacher.surname, lesson.name FROM teacher LEFT OUTER JOIN lesson ON teacher.id = lesson.teacher_id;
+---------+-------------+
| surname | name        |
+---------+-------------+
| Иванов  | Математика  |
| Иванов  | Информатика |
| Иванов  | Математика  |
| Иванов  | Информатика |
| Петров  | Русский     |
| Петров  | Русский     |
| Сидоров | Физика      |
| Сидоров | Физика      |
| Чижов   | NULL        |
| Петров  | NULL        |
+---------+-------------+
10 rows in set (0.00 sec)

mysql> SELECT teacher.surname, lesson.name FROM teacher RIGHT OUTER JOIN lesson ON teacher.id = lesson.teacher_id;
+---------+-------------+
| surname | name        |
+---------+-------------+
| Иванов  | Математика  |
| Иванов  | Информатика |
| Петров  | Русский     |
| Сидоров | Физика      |
| Иванов  | Математика  |
| Иванов  | Информатика |
| Петров  | Русский     |
| Сидоров | Физика      |
+---------+-------------+
8 rows in set (0.00 sec)

mysql> ВЕРТИКАЛЬНОЕ ОБЪЕДИНЕНИЕ ТАБЛИЦ

mysql> SELECT * FROM teacher UNION SELECT * FROM lesson;
+----+-------------+------+
| id | surname     | age  |
+----+-------------+------+
|  1 | Иванов      |   25 |
|  2 | Петров      |   30 |
|  3 | Сидоров     |   35 |
|  4 | Чижов       |   40 |
|  5 | Петров      |   45 |
|  1 | Математика  |    1 |
|  2 | Информатика |    1 |
|  3 | Русский     |    2 |
|  4 | Физика      |    3 |
|  5 | Математика  |    1 |
|  6 | Информатика |    1 |
|  7 | Русский     |    2 |
|  8 | Физика      |    3 |
+----+-------------+------+
13 rows in set (0.00 sec)

mysql> SELECT * FROM lesson UNION SELECT * FROM teacher;
+----+-------------+------------+
| id | name        | teacher_id |
+----+-------------+------------+
|  1 | Математика  |          1 |
|  2 | Информатика |          1 |
|  3 | Русский     |          2 |
|  4 | Физика      |          3 |
|  5 | Математика  |          1 |
|  6 | Информатика |          1 |
|  7 | Русский     |          2 |
|  8 | Физика      |          3 |
|  1 | Иванов      |         25 |
|  2 | Петров      |         30 |
|  3 | Сидоров     |         35 |
|  4 | Чижов       |         40 |
|  5 | Петров      |         45 |
+----+-------------+------------+
13 rows in set (0.00 sec)


ФУНКЦИИ: AVG => СРЕДНЕЕ ЗНАЧЕНИЕ, MAX, MIN, SUM ...

mysql> SELECT AVG(age) FROM teacher;
+----------+
| AVG(age) |
+----------+
|  35.0000 |
+----------+
1 row in set (0.00 sec)

mysql> SELECT MAX(age), MIN(age) FROM teacher;
+----------+----------+
| MAX(age) | MIN(age) |
+----------+----------+
|       45 |       25 |
+----------+----------+
1 row in set (0.00 sec)

mysql> SELECT SUM(age) FROM teacher;
+----------+
| SUM(age) |
+----------+
|      175 |
+----------+
1 row in set (0.00 sec)

mysql> INSERT INTO teacher (surname, age) VALUES ("Николаев", 25), ("Шишкин", 30);
Query OK, 2 rows affected (0.00 sec)
Records: 2  Duplicates: 0  Warnings: 0

mysql> select * from teacher;
+----+----------+------+
| id | surname  | age  |
+----+----------+------+
|  1 | Иванов   |   25 |
|  2 | Петров   |   30 |
|  3 | Сидоров  |   35 |
|  4 | Чижов    |   40 |
|  5 | Петров   |   45 |
|  7 | Николаев |   25 |
|  8 | Шишкин   |   30 |
+----+----------+------+

mysql> SELECT age, COUNT(age) FROM teacher;
ERROR 1140 (42000): In aggregated query without GROUP BY, expression #1 of SELECT list contains nonaggregated column 'sql_course.teacher.age'; this is incompatible with sql_mode=only_full_group_by


mysql> SELECT age, COUNT(age) FROM teacher GROUP BY age;
+------+------------+
| age  | COUNT(age) |
+------+------------+
|   25 |          2 |
|   30 |          2 |
|   35 |          1 |
|   40 |          1 |
|   45 |          1 |
+------+------------+
5 rows in set (0.00 sec)

mysql> SELECT * FROM teacher WHERE id = 1;
+----+---------+------+
| id | surname | age  |
+----+---------+------+
|  1 | Иванов  |   25 |
+----+---------+------+
1 row in set (0.00 sec)

mysql>

mysql> SELECT * FROM teacher WHERE id > 1;
+----+----------+------+
| id | surname  | age  |
+----+----------+------+
|  2 | Петров   |   30 |
|  3 | Сидоров  |   35 |
|  4 | Чижов    |   40 |
|  5 | Петров   |   45 |
|  7 | Николаев |   25 |
|  8 | Шишкин   |   30 |
+----+----------+------+
6 rows in set (0.00 sec)
